[
  {
    "venue": "中山",
    "race_no": 1,
    "race_model": "ダート1200mで前に行く馬の速度を重視しつつ、直線で脚を使える差し馬を相手に置く。芝からの転戦でも調教が大きく上向く馬は一発候補とする。",
    "marks": [
      4,
      9,
      7,
      15,
      16
    ],
    "mainline_cases": [
      {
        "horse_no": 4,
        "case": "能力と近走内容が今回のレースモデルに最も合い、勝ち筋が明確。"
      },
      {
        "horse_no": 9,
        "case": "近走の再現性と適性が高く、本線相手として信頼できる。"
      },
      {
        "horse_no": 15,
        "case": "展開と適性の噛み合わせが良く、連下以上まで十分届く。"
      },
      {
        "horse_no": 16,
        "case": "第五印の境界で比較しても、今回の条件への適合を優先した。"
      }
    ],
    "single_shot_case": {
      "horse_no": 7,
      "case": "本線順位とは切り離し、展開が振れた時に勝ち切る非対称な一発の筋を評価した。"
    },
    "boundary_review": {
      "alternative_horse_no": 1,
      "reason": "1番も候補だが、最終△2の方が今回の条件で再現しやすい勝負圏ルートを持つと判断した。"
    },
    "rrdb_refs": [],
    "reader_facing_reason": "4番は1200m連続2着で能力・調教とも抜けて中心。9番は前走4着で長く脚を使えて対抗。7番は芝からのダート替わりだが調教抜群で、先行力が転化すれば一発余地。15番は1200mで安定して差し、終い最上位。16番は初戦1400mで先行して粘った内容を評価。"
  },
  {
    "venue": "中山",
    "race_no": 2,
    "race_model": "ダート1800mで先行力と同距離実績を最優先し、未経験の転戦馬は仕上がりと血統的な余地を込みで穴評価に留める。",
    "marks": [
      6,
      3,
      9,
      11,
      1
    ],
    "mainline_cases": [
      {
        "horse_no": 6,
        "case": "能力と近走内容が今回のレースモデルに最も合い、勝ち筋が明確。"
      },
      {
        "horse_no": 3,
        "case": "近走の再現性と適性が高く、本線相手として信頼できる。"
      },
      {
        "horse_no": 11,
        "case": "展開と適性の噛み合わせが良く、連下以上まで十分届く。"
      },
      {
        "horse_no": 1,
        "case": "第五印の境界で比較しても、今回の条件への適合を優先した。"
      }
    ],
    "single_shot_case": {
      "horse_no": 9,
      "case": "本線順位とは切り離し、展開が振れた時に勝ち切る非対称な一発の筋を評価した。"
    },
    "boundary_review": {
      "alternative_horse_no": 2,
      "reason": "2番も候補だが、最終△2の方が今回の条件で再現しやすい勝負圏ルートを持つと判断した。"
    },
    "rrdb_refs": [],
    "reader_facing_reason": "6番は1800mで2・3着と安定し調教も抜群、逃げ先行で軸。3番は1600m初戦3着で終いも使え、距離延長に対応できれば相手筆頭。9番は芝からの転戦だが仕上がり良好で変化余地がある。11番は1800m4着、1番も同距離4着があり連下候補。"
  },
  {
    "venue": "中山",
    "race_no": 3,
    "race_model": "ダート1200mで先行力の高い馬が揃い、前半の競り合いを耐えられる地力を重視する。差し脚が目立つ馬は前崩れの単発勝ち筋として拾う。",
    "marks": [
      8,
      12,
      4,
      2,
      13
    ],
    "mainline_cases": [
      {
        "horse_no": 8,
        "case": "能力と近走内容が今回のレースモデルに最も合い、勝ち筋が明確。"
      },
      {
        "horse_no": 12,
        "case": "近走の再現性と適性が高く、本線相手として信頼できる。"
      },
      {
        "horse_no": 2,
        "case": "展開と適性の噛み合わせが良く、連下以上まで十分届く。"
      },
      {
        "horse_no": 13,
        "case": "第五印の境界で比較しても、今回の条件への適合を優先した。"
      }
    ],
    "single_shot_case": {
      "horse_no": 4,
      "case": "本線順位とは切り離し、展開が振れた時に勝ち切る非対称な一発の筋を評価した。"
    },
    "boundary_review": {
      "alternative_horse_no": 9,
      "reason": "9番も候補だが、最終△2の方が今回の条件で再現しやすい勝負圏ルートを持つと判断した。"
    },
    "rrdb_refs": [],
    "reader_facing_reason": "8番は1200m2着と勝ち実績があり指数も高く中心。12番は1400mで高い指数を維持し短縮で先行力が生きる。4番は1400mで終いを使う形があり、流れが速くなれば差し込みの一発。2番は1400m2着と1200m勝ち、13番は1200m3着の実績で押さえる。"
  },
  {
    "venue": "中山",
    "race_no": 4,
    "race_model": "障害2880mは平地指数ではなく飛越経験と近走の障害内容を軸にし、安定して完走し上位争いしている馬を優先する。飛越に課題があっても能力で補える馬を▲に置く。",
    "marks": [
      7,
      12,
      6,
      8,
      9
    ],
    "mainline_cases": [
      {
        "horse_no": 7,
        "case": "能力と近走内容が今回のレースモデルに最も合い、勝ち筋が明確。"
      },
      {
        "horse_no": 12,
        "case": "近走の再現性と適性が高く、本線相手として信頼できる。"
      },
      {
        "horse_no": 8,
        "case": "展開と適性の噛み合わせが良く、連下以上まで十分届く。"
      },
      {
        "horse_no": 9,
        "case": "第五印の境界で比較しても、今回の条件への適合を優先した。"
      }
    ],
    "single_shot_case": {
      "horse_no": 6,
      "case": "本線順位とは切り離し、展開が振れた時に勝ち切る非対称な一発の筋を評価した。"
    },
    "boundary_review": {
      "alternative_horse_no": 2,
      "reason": "2番も候補だが、最終△2の方が今回の条件で再現しやすい勝負圏ルートを持つと判断した。"
    },
    "rrdb_refs": [],
    "reader_facing_reason": "7番は2910m3着があり調教上昇も大きく中心。12番は2860m2着で近走内容が最も安定。6番は飛越に課題を残すが2970m3着があり、噛み合えば一発。8番は障害で連続4・3着、9番も同条件近辺で3・5着と堅実。"
  },
  {
    "venue": "中山",
    "race_no": 5,
    "race_model": "芝1600mで先行力と直線の伸びを両立する馬を上位にし、初戦で末脚を見せた馬を独立した上昇候補として拾う。",
    "marks": [
      4,
      13,
      11,
      1,
      16
    ],
    "mainline_cases": [
      {
        "horse_no": 4,
        "case": "能力と近走内容が今回のレースモデルに最も合い、勝ち筋が明確。"
      },
      {
        "horse_no": 13,
        "case": "近走の再現性と適性が高く、本線相手として信頼できる。"
      },
      {
        "horse_no": 1,
        "case": "展開と適性の噛み合わせが良く、連下以上まで十分届く。"
      },
      {
        "horse_no": 16,
        "case": "第五印の境界で比較しても、今回の条件への適合を優先した。"
      }
    ],
    "single_shot_case": {
      "horse_no": 11,
      "case": "本線順位とは切り離し、展開が振れた時に勝ち切る非対称な一発の筋を評価した。"
    },
    "boundary_review": {
      "alternative_horse_no": 9,
      "reason": "9番も候補だが、最終△2の方が今回の条件で再現しやすい勝負圏ルートを持つと判断した。"
    },
    "rrdb_refs": [],
    "reader_facing_reason": "4番は初戦2着で能力・調教とも抜け、軸として素直。13番は1800m3着と1600m6着で終いの性能が高い。11番は初戦3着で出遅れながら追い上げており、上積みがあれば一発。1番は1600m5着から調教上昇、16番は同距離4着の安定感を評価。"
  },
  {
    "venue": "中山",
    "race_no": 6,
    "race_model": "芝2000mで前後のバランスが重要になり、同距離で長く脚を使えている馬を中心にする。勝ち切れないが末脚の質が高い馬は展開差し込みの▲候補。",
    "marks": [
      2,
      14,
      9,
      6,
      10
    ],
    "mainline_cases": [
      {
        "horse_no": 2,
        "case": "能力と近走内容が今回のレースモデルに最も合い、勝ち筋が明確。"
      },
      {
        "horse_no": 14,
        "case": "近走の再現性と適性が高く、本線相手として信頼できる。"
      },
      {
        "horse_no": 6,
        "case": "展開と適性の噛み合わせが良く、連下以上まで十分届く。"
      },
      {
        "horse_no": 10,
        "case": "第五印の境界で比較しても、今回の条件への適合を優先した。"
      }
    ],
    "single_shot_case": {
      "horse_no": 9,
      "case": "本線順位とは切り離し、展開が振れた時に勝ち切る非対称な一発の筋を評価した。"
    },
    "boundary_review": {
      "alternative_horse_no": 3,
      "reason": "3番も候補だが、最終△2の方が今回の条件で再現しやすい勝負圏ルートを持つと判断した。"
    },
    "rrdb_refs": [],
    "reader_facing_reason": "2番は2000m2・4着で調教も抜群、最も安定した勝ち筋。14番は同距離で連続3着、持続力が高い。9番は着順以上に上がり性能があり、流れが向けば一発。6番は2400m3着で持続力、10番は2000m2着歴を評価する。"
  },
  {
    "venue": "中山",
    "race_no": 7,
    "race_model": "芝2000mの少頭数で能力差が出やすく、直近の芝中距離で高い指数を示す馬を素直に上位に取る。前走大敗でも勝ち切り実績と末脚がある馬は単発反撃を警戒する。",
    "marks": [
      4,
      2,
      7,
      3,
      6
    ],
    "mainline_cases": [
      {
        "horse_no": 4,
        "case": "能力と近走内容が今回のレースモデルに最も合い、勝ち筋が明確。"
      },
      {
        "horse_no": 2,
        "case": "近走の再現性と適性が高く、本線相手として信頼できる。"
      },
      {
        "horse_no": 3,
        "case": "展開と適性の噛み合わせが良く、連下以上まで十分届く。"
      },
      {
        "horse_no": 6,
        "case": "第五印の境界で比較しても、今回の条件への適合を優先した。"
      }
    ],
    "single_shot_case": {
      "horse_no": 7,
      "case": "本線順位とは切り離し、展開が振れた時に勝ち切る非対称な一発の筋を評価した。"
    },
    "boundary_review": {
      "alternative_horse_no": 8,
      "reason": "8番も候補だが、最終△2の方が今回の条件で再現しやすい勝負圏ルートを持つと判断した。"
    },
    "rrdb_refs": [],
    "reader_facing_reason": "4番は2000m勝ちの内容と調教抜群で中心。2番は2000m4着・1800m勝ちで能力上位。7番は前走大敗でも1800m勝ちと末脚評価があり、少頭数で立て直せば一発。3番は2200m勝ちがあり先行残り、6番は中距離での持続力を評価。"
  },
  {
    "venue": "中山",
    "race_no": 8,
    "race_model": "ダート1800mで先行勢の質と同距離の安定度を重視し、前が競る場合に備えて後方から確実に脚を使える馬を▲に取る。",
    "marks": [
      16,
      10,
      2,
      8,
      9
    ],
    "mainline_cases": [
      {
        "horse_no": 16,
        "case": "能力と近走内容が今回のレースモデルに最も合い、勝ち筋が明確。"
      },
      {
        "horse_no": 10,
        "case": "近走の再現性と適性が高く、本線相手として信頼できる。"
      },
      {
        "horse_no": 8,
        "case": "展開と適性の噛み合わせが良く、連下以上まで十分届く。"
      },
      {
        "horse_no": 9,
        "case": "第五印の境界で比較しても、今回の条件への適合を優先した。"
      }
    ],
    "single_shot_case": {
      "horse_no": 2,
      "case": "本線順位とは切り離し、展開が振れた時に勝ち切る非対称な一発の筋を評価した。"
    },
    "boundary_review": {
      "alternative_horse_no": 11,
      "reason": "11番も候補だが、最終△2の方が今回の条件で再現しやすい勝負圏ルートを持つと判断した。"
    },
    "rrdb_refs": [],
    "reader_facing_reason": "16番は1800m2・4着で調教上昇、先行して崩れにくく中心。10番は1600mで高指数を連続し距離延長にも余力。2番は1700m2着時に外を回して伸びており、前崩れなら一発。8番は1800～2100mで安定、9番は同距離で堅実に差す。"
  },
  {
    "venue": "中山",
    "race_no": 9,
    "race_model": "ダート1200mの2勝クラスで、先行力だけでなくクラス水準の指数と終いの持続力を重視する。前が速くなれば差し脚の強い馬を▲として狙う。",
    "marks": [
      13,
      2,
      12,
      6,
      11
    ],
    "mainline_cases": [
      {
        "horse_no": 13,
        "case": "能力と近走内容が今回のレースモデルに最も合い、勝ち筋が明確。"
      },
      {
        "horse_no": 2,
        "case": "近走の再現性と適性が高く、本線相手として信頼できる。"
      },
      {
        "horse_no": 6,
        "case": "展開と適性の噛み合わせが良く、連下以上まで十分届く。"
      },
      {
        "horse_no": 11,
        "case": "第五印の境界で比較しても、今回の条件への適合を優先した。"
      }
    ],
    "single_shot_case": {
      "horse_no": 12,
      "case": "本線順位とは切り離し、展開が振れた時に勝ち切る非対称な一発の筋を評価した。"
    },
    "boundary_review": {
      "alternative_horse_no": 10,
      "reason": "10番も候補だが、最終△2の方が今回の条件で再現しやすい勝負圏ルートを持つと判断した。"
    },
    "rrdb_refs": [],
    "reader_facing_reason": "13番は近走1400mで高指数を保ち、1200m短縮で先行力が生きる。2番は1200m2着と1400m4着で安定。12番は1200mで3着歴があり終いの質も高く、展開差し込みの一発。6番は1200m勝ち実績、11番は後方からでも上がりを使える点を評価。"
  },
  {
    "venue": "中山",
    "race_no": 10,
    "race_model": "芝1800mの3勝クラスで、中距離の高い能力指数と末脚の再現性を中心に評価する。前走内容にロスがあった差し馬は展開ひとつで上振れる。",
    "marks": [
      8,
      5,
      6,
      7,
      4
    ],
    "mainline_cases": [
      {
        "horse_no": 8,
        "case": "能力と近走内容が今回のレースモデルに最も合い、勝ち筋が明確。"
      },
      {
        "horse_no": 5,
        "case": "近走の再現性と適性が高く、本線相手として信頼できる。"
      },
      {
        "horse_no": 7,
        "case": "展開と適性の噛み合わせが良く、連下以上まで十分届く。"
      },
      {
        "horse_no": 4,
        "case": "第五印の境界で比較しても、今回の条件への適合を優先した。"
      }
    ],
    "single_shot_case": {
      "horse_no": 6,
      "case": "本線順位とは切り離し、展開が振れた時に勝ち切る非対称な一発の筋を評価した。"
    },
    "boundary_review": {
      "alternative_horse_no": 2,
      "reason": "2番も候補だが、最終△2の方が今回の条件で再現しやすい勝負圏ルートを持つと判断した。"
    },
    "rrdb_refs": [],
    "reader_facing_reason": "8番は2000m勝ちの指数が一枚上で、末脚の反復性も高く中心。5番は2200m勝ちと調教抜群で対抗。6番は2000m2着時に外を回しており、1800m短縮で一発余地。7番は1800m勝ちがあり適性明確。4番は近走不振でも能力と仕上がりで押さえる。"
  },
  {
    "venue": "中山",
    "race_no": 11,
    "race_model": "ダート1200mのオープンで前半が速くなりやすく、先行力と高い持続指数を本線にしつつ、後方から最速級の脚を使える馬を▲にする。",
    "marks": [
      10,